{
  "schemaVersion": "1.0",
  "catalogType": "recipes",
  "generatedAt": "2026-08-31T23:15:00Z",
  "items": [
    {
      "id": "recipe-jollof-style-tomato-pepper-soup",
      "title": "Jollof-Style Tomato and Pepper Soup",
      "summary": "A bright, blended tomato-and-red-pepper soup draws on the flavor foundation used in several West African dishes. Ginger, garlic, thyme, and a controlled amount of hot pepper make it a warming opening course.",
      "courseRoles": [
        "STARTER"
      ],
      "culturalTraditions": [
        "West African-inspired"
      ],
      "servings": 6,
      "times": {
        "prepMinutes": 20,
        "cookMinutes": 30,
        "totalMinutes": 50
      },
      "ingredients": [
        {
          "ingredientId": "ingredient-red-bell-pepper",
          "name": "red bell peppers",
          "canonicalName": "red bell pepper",
          "quantityText": "6 peppers",
          "normalizedQuantity": {
            "value": 6,
            "unit": "item"
          },
          "category": "PRODUCE",
          "isOptional": false
        },
        {
          "ingredientId": "ingredient-tomato",
          "name": "tomatoes",
          "canonicalName": "tomato",
          "quantityText": "4 large tomatoes",
          "normalizedQuantity": {
            "value": 4,
            "unit": "item"
          },
          "category": "PRODUCE",
          "isOptional": false
        },
        {
          "ingredientId": "ingredient-red-onion",
          "name": "red onions",
          "canonicalName": "red onion",
          "quantityText": "2 medium onions",
          "normalizedQuantity": {
            "value": 2,
            "unit": "item"
          },
          "category": "PRODUCE",
          "isOptional": false
        },
        {
          "ingredientId": "ingredient-ginger",
          "name": "fresh ginger",
          "canonicalName": "ginger",
          "quantityText": "2-inch piece",
          "normalizedQuantity": {
            "value": 2,
            "unit": "inch"
          },
          "category": "PRODUCE",
          "isOptional": false
        },
        {
          "ingredientId": "ingredient-garlic",
          "name": "garlic",
          "canonicalName": "garlic",
          "quantityText": "6 cloves",
          "normalizedQuantity": {
            "value": 6,
            "unit": "clove"
          },
          "category": "PRODUCE",
          "isOptional": false
        },
        {
          "ingredientId": "ingredient-vegetable-stock",
          "name": "vegetable stock",
          "canonicalName": "vegetable stock",
          "quantityText": "6 cups",
          "normalizedQuantity": {
            "value": 6,
            "unit": "cup"
          },
          "category": "PANTRY",
          "isOptional": false
        },
        {
          "ingredientId": "ingredient-scotch-bonnet-pepper",
          "name": "Scotch bonnet pepper",
          "canonicalName": "scotch bonnet pepper",
          "quantityText": "1 pepper",
          "normalizedQuantity": {
            "value": 1,
            "unit": "item"
          },
          "category": "PRODUCE",
          "isOptional": true
        }
      ],
      "instructions": {
        "mode": "SOURCE_LINK",
        "sourceUrl": "https://cheflolaskitchen.com/nigerian-pepper-sauce-ata-dindin/",
        "rightsNote": "Use the linked source for instructions. This catalog stores an original summary and structured ingredient data, not source instruction text."
      },
      "dietaryTags": [
        "VEGAN",
        "GLUTEN_FREE",
        "DAIRY_FREE"
      ],
      "allergens": [],
      "themeConnections": [
        {
          "theme": "ADAPTATION",
          "explanation": "A familiar pantry base becomes a shared first course through a change in form, from sauce foundation to table soup.",
          "sourceIds": [
            "src-jollof-soup"
          ]
        }
      ],
      "sourceRefs": [
        {
          "sourceId": "src-jollof-soup",
          "provider": "Chef Lola's Kitchen",
          "title": "Nigerian Pepper Sauce - Ata dindin",
          "url": "https://cheflolaskitchen.com/nigerian-pepper-sauce-ata-dindin/",
          "accessedAt": "2026-08-31T17:56:00Z",
          "attribution": "Recipe and culinary-context source. Catalog summary, theme connection, and ingredient normalization are original.",
          "licenseNote": "Instructions remain at the linked source; no source recipe prose or images are stored here."
        }
      ],
      "reviewStatus": "DRAFT"
    },
    {
      "id": "recipe-kelewele-style-roasted-plantains",
      "title": "Kelewele-Style Roasted Plantains",
      "summary": "Ripe plantains are roasted with ginger, warming spices, citrus, and a savory peanut-miso glaze. The dish takes inspiration from Ghanaian kelewele while using an oven method and a clearly labeled modern garnish.",
      "courseRoles": [
        "STARTER"
      ],
      "culturalTraditions": [
        "Ghanaian-inspired"
      ],
      "servings": 6,
      "times": {
        "prepMinutes": 25,
        "cookMinutes": 85,
        "totalMinutes": 110
      },
      "ingredients": [
        {
          "ingredientId": "ingredient-ripe-plantain",
          "name": "ripe plantains",
          "canonicalName": "ripe plantain",
          "quantityText": "6 medium plantains",
          "normalizedQuantity": {
            "value": 6,
            "unit": "item"
          },
          "category": "PRODUCE",
          "isOptional": false
        },
        {
          "ingredientId": "ingredient-orange-juice",
          "name": "orange juice",
          "canonicalName": "orange juice",
          "quantityText": "1 1/2 cups",
          "normalizedQuantity": {
            "value": 1.5,
            "unit": "cup"
          },
          "category": "PRODUCE",
          "isOptional": false
        },
        {
          "ingredientId": "ingredient-lime",
          "name": "lime juice",
          "canonicalName": "lime",
          "quantityText": "3 limes",
          "normalizedQuantity": {
            "value": 3,
            "unit": "item"
          },
          "category": "PRODUCE",
          "isOptional": false
        },
        {
          "ingredientId": "ingredient-peanut-butter",
          "name": "peanut butter",
          "canonicalName": "peanut butter",
          "quantityText": "3/8 cup",
          "normalizedQuantity": {
            "value": 0.375,
            "unit": "cup"
          },
          "category": "PANTRY",
          "isOptional": false
        },
        {
          "ingredientId": "ingredient-miso",
          "name": "white miso",
          "canonicalName": "miso",
          "quantityText": "1 1/2 tablespoons",
          "normalizedQuantity": {
            "value": 1.5,
            "unit": "tablespoon"
          },
          "category": "REFRIGERATED",
          "isOptional": false
        },
        {
          "ingredientId": "ingredient-soy-sauce",
          "name": "soy sauce",
          "canonicalName": "soy sauce",
          "quantityText": "1 1/2 tablespoons",
          "normalizedQuantity": {
            "value": 1.5,
            "unit": "tablespoon"
          },
          "category": "PANTRY",
          "isOptional": false
        },
        {
          "ingredientId": "ingredient-ginger",
          "name": "fresh ginger",
          "canonicalName": "ginger",
          "quantityText": "3 inches",
          "normalizedQuantity": {
            "value": 3,
            "unit": "inch"
          },
          "category": "PRODUCE",
          "isOptional": false
        }
      ],
      "instructions": {
        "mode": "SOURCE_LINK",
        "sourceUrl": "https://cooking.nytimes.com/recipes/1027632-roasted-kelewele-spiced-plantains-with-crispy-shallots-and-herbs",
        "rightsNote": "Use the linked source for instructions. This catalog stores an original summary and structured ingredient data, not source instruction text."
      },
      "dietaryTags": [
        "VEGETARIAN",
        "DAIRY_FREE"
      ],
      "allergens": [
        "PEANUT",
        "SOY",
        "WHEAT"
      ],
      "themeConnections": [
        {
          "theme": "CHANGE",
          "explanation": "Roasting rather than frying reframes a plantain snack for a communal dinner while keeping spice and fruit at the center.",
          "sourceIds": [
            "src-kelewele-plantains"
          ]
        }
      ],
      "sourceRefs": [
        {
          "sourceId": "src-kelewele-plantains",
          "provider": "The New York Times",
          "title": "Roasted Kelewele (Spiced Plantains) With Crispy Shallots and Herbs",
          "url": "https://cooking.nytimes.com/recipes/1027632-roasted-kelewele-spiced-plantains-with-crispy-shallots-and-herbs",
          "accessedAt": "2026-08-31T12:00:00Z",
          "attribution": "Recipe and culinary-context source. Catalog summary, theme connection, and ingredient normalization are original.",
          "licenseNote": "Instructions remain at the linked source; no source recipe prose or images are stored here."
        }
      ],
      "reviewStatus": "DRAFT",
      "reviewNotes": "Contains honey and soy sauce. Human review should confirm gluten-free substitutions if needed."
    },
    {
      "id": "recipe-black-eyed-pea-fritters",
      "title": "Akara-Style Black-Eyed Pea Fritters",
      "summary": "Peeled black-eyed peas, onion, and hot pepper are blended and fried into crisp-edged, tender fritters. Akara is a well-known Nigerian preparation; the catalog source link provides the method rather than reproducing it here.",
      "courseRoles": [
        "STARTER"
      ],
      "culturalTraditions": [
        "Nigerian"
      ],
      "servings": 6,
      "times": {
        "prepMinutes": 120,
        "cookMinutes": 20,
        "totalMinutes": 140
      },
      "ingredients": [
        {
          "ingredientId": "ingredient-black-eyed-peas",
          "name": "dried black-eyed peas",